{
  "schema": 1,
  "reviewed_row10_sha256": "f33929daa665e7bb9a7fae62df7c7874ab51d95b7cb92d64a550fcb0f59c46a5",
  "classes": {
    "rrc": "ASN.1 UPER/aligned-PER RRC grammars",
    "mlme": "802.11 MLME element grammars",
    "nas": "IEI/TLV 5G-NAS grammar",
    "usb": "USB grammars",
    "image": "image",
    "media": "media",
    "font": "font",
    "archive": "archive",
    "document": "document formats",
    "pack": "pack",
    "manifest": "manifest descriptors",
    "x509": "X.509 DER certificate and chain descriptors",
    "module-manifest": "immutable-module manifest",
    "module-certificate": "certificate",
    "module-endorsement": "endorsement",
    "module-message": "message descriptors",
    "ensemble": "ensemble link's frame descriptor set"
  },
  "entries": [
    {
      "id": "nr-rrc",
      "name": "NR RRC ASN.1 UPER and aligned-PER profiles",
      "classes": [
        "rrc"
      ],
      "requirements": [
        "R-05-042",
        "R-05-048",
        "R-18-029"
      ],
      "owner": "none",
      "descriptor": "absent",
      "transcription": "none authored",
      "canonicity": "Role-gated: a theorem is owed before any identity-consuming use; the profile must enumerate those sites and refuse the role without the theorem.",
      "evidence": "The verified ASN.1-to-Narcissus front end and published-module instantiation are absent. NAS is separately inventoried as IEI/TLV, not ASN.1.",
      "references": [
        "docs/requirements-register.md"
      ],
      "members_from": null
    },
    {
      "id": "fiveg-nas",
      "name": "5G-core NAS IEI/TLV",
      "classes": [
        "nas"
      ],
      "requirements": [
        "R-05-050",
        "R-18-029"
      ],
      "owner": "none",
      "descriptor": "absent",
      "transcription": "NAS grammar required",
      "canonicity": "Role-gated: a theorem is owed before any identity-consuming use; the profile must enumerate those sites and refuse the role without the theorem.",
      "evidence": "The exceptional hand-transcribed grammar and its four-reference differential corpus are both absent.",
      "references": [
        "docs/requirements-register.md"
      ],
      "members_from": null
    },
    {
      "id": "wifi-mlme",
      "name": "802.11 MLME elements and security handshake framing",
      "classes": [
        "mlme"
      ],
      "requirements": [
        "R-05-042",
        "R-12-040",
        "R-12-043b"
      ],
      "owner": "none",
      "descriptor": "absent",
      "transcription": "none authored",
      "canonicity": "Required: identity, signature, hash or equality consumers require a whole-language theorem against the eventual Narcissus descriptor; none is present.",
      "evidence": "No descriptor, codec or correctness pair is authored.",
      "references": [
        "docs/requirements-register.md"
      ],
      "members_from": null
    },
    {
      "id": "cellular-lower",
      "name": "NR MAC, RLC and PDCP framing",
      "classes": [],
      "requirements": [
        "R-12-039",
        "R-12-040"
      ],
      "owner": "none",
      "descriptor": "absent",
      "transcription": "none authored",
      "canonicity": "Role-gated: a theorem is owed before any identity-consuming use; the profile must enumerate those sites and refuse the role without the theorem.",
      "evidence": "No descriptor, codec or correctness pair is authored.",
      "references": [
        "docs/requirements-register.md"
      ],
      "members_from": null
    },
    {
      "id": "wifi-data",
      "name": "802.11 data framing",
      "classes": [],
      "requirements": [
        "R-12-039",
        "R-12-040"
      ],
      "owner": "none",
      "descriptor": "absent",
      "transcription": "none authored",
      "canonicity": "Role-gated: a theorem is owed before any identity-consuming use; the profile must enumerate those sites and refuse the role without the theorem.",
      "evidence": "No descriptor, codec or correctness pair is authored.",
      "references": [
        "docs/requirements-register.md"
      ],
      "members_from": null
    },
    {
      "id": "bluetooth",
      "name": "Bluetooth link, L2CAP, GATT and pairing records",
      "classes": [],
      "requirements": [
        "R-12-039",
        "R-12-040",
        "R-12-043b"
      ],
      "owner": "none",
      "descriptor": "absent",
      "transcription": "none authored",
      "canonicity": "Required: identity, signature, hash or equality consumers require a whole-language theorem against the eventual Narcissus descriptor; none is present.",
      "evidence": "No descriptor, codec or correctness pair is authored.",
      "references": [
        "docs/requirements-register.md"
      ],
      "members_from": null
    },
    {
      "id": "gnss",
      "name": "GNSS receive navigation-message framing",
      "classes": [],
      "requirements": [
        "R-12-038",
        "R-05-042"
      ],
      "owner": "none",
      "descriptor": "absent",
      "transcription": "none authored",
      "canonicity": "Role-gated: a theorem is owed before any identity-consuming use; the profile must enumerate those sites and refuse the role without the theorem.",
      "evidence": "The receive-only service is named; its message profile, parser and bounded grammar remain unselected.",
      "references": [
        "docs/requirements-register.md"
      ],
      "members_from": null
    },
    {
      "id": "ims",
      "name": "IMS session and voice-transport grammars",
      "classes": [],
      "requirements": [
        "R-12-041",
        "R-02-003b"
      ],
      "owner": "none",
      "descriptor": "absent",
      "transcription": "none authored",
      "canonicity": "Role-gated: a theorem is owed before any identity-consuming use; the profile must enumerate those sites and refuse the role without the theorem.",
      "evidence": "The handset instantiation's ordinary and emergency voice require these grammars; the laptop first release carries none of them. Session signalling, media transport and codec subsets remain to be fixed; no IMS parser is credited.",
      "references": [
        "docs/requirements-register.md"
      ],
      "members_from": null
    },
    {
      "id": "ip-call",
      "name": "IP call session-signalling and media-transport grammars",
      "classes": [],
      "requirements": [
        "R-18-004a",
        "R-05-042"
      ],
      "owner": "none",
      "descriptor": "absent",
      "transcription": "none authored",
      "canonicity": "Role-gated: a theorem is owed before any identity-consuming use; the profile must enumerate those sites and refuse the role without the theorem.",
      "evidence": "The laptop floor's call and camera members require a session-signalling and media-transport profile carried inside a secure session. The protocol, packetization and codec subsets remain unselected; no parser is credited.",
      "references": [
        "docs/requirements-register.md"
      ],
      "members_from": null
    },
    {
      "id": "euicc",
      "name": "eUICC APDU and TPDU records",
      "classes": [],
      "requirements": [
        "R-12-047"
      ],
      "owner": "none",
      "descriptor": "absent",
      "transcription": "none authored",
      "canonicity": "Role-gated: a theorem is owed before any identity-consuming use; the profile must enumerate those sites and refuse the role without the theorem.",
      "evidence": "No descriptor, codec or correctness pair is authored.",
      "references": [
        "docs/requirements-register.md"
      ],
      "members_from": null
    },
    {
      "id": "usb-enumeration",
      "name": "USB enumeration, configuration, control and endpoint framing",
      "classes": [
        "usb"
      ],
      "requirements": [
        "R-12-058",
        "R-12-060",
        "R-05-042"
      ],
      "owner": "none",
      "descriptor": "absent",
      "transcription": "none authored",
      "canonicity": "Role-gated: a theorem is owed before any identity-consuming use; the profile must enumerate those sites and refuse the role without the theorem.",
      "evidence": "No descriptor, codec or correctness pair is authored.",
      "references": [
        "docs/requirements-register.md"
      ],
      "members_from": null
    },
    {
      "id": "usb-auth",
      "name": "USB device and cable authentication records",
      "classes": [
        "usb"
      ],
      "requirements": [
        "R-12-061"
      ],
      "owner": "none",
      "descriptor": "absent",
      "transcription": "none authored",
      "canonicity": "Required: identity, signature, hash or equality consumers require a whole-language theorem against the eventual Narcissus descriptor; none is present.",
      "evidence": "No descriptor, codec or correctness pair is authored.",
      "references": [
        "docs/requirements-register.md"
      ],
      "members_from": null
    },
    {
      "id": "usb-hid",
      "name": "USB HID report descriptors and reports",
      "classes": [
        "usb"
      ],
      "requirements": [
        "R-12-063"
      ],
      "owner": "none",
      "descriptor": "absent",
      "transcription": "none authored",
      "canonicity": "Role-gated: a theorem is owed before any identity-consuming use; the profile must enumerate those sites and refuse the role without the theorem.",
      "evidence": "No descriptor, codec or correctness pair is authored.",
      "references": [
        "docs/requirements-register.md"
      ],
      "members_from": null
    },
    {
      "id": "usb-class",
      "name": "Other admitted USB class grammars",
      "classes": [
        "usb"
      ],
      "requirements": [
        "R-12-058",
        "R-12-062"
      ],
      "owner": "none",
      "descriptor": "absent",
      "transcription": "none authored",